{
  "stub_id": "pg-compile-harness-stub-001",
  "version": "0.23.0",
  "status": "disabled",
  "no_execution_now": true,
  "future_gate_required": true,
  "source_design_manifest": "docs/backend/supabase/local-compile-harness/local-postgres-compile-harness.manifest.json",
  "source_sql_files": [
    "docs/backend/supabase/rehearsal/001_ai_scan_storage_schema.rehearsal.sql",
    "docs/backend/supabase/rehearsal/001_ai_scan_storage_schema.rollback.rehearsal.sql"
  ],
  "forbidden_now": [
    "docker",
    "docker compose",
    "psql",
    "supabase cli",
    "supabase link",
    "supabase db push",
    "live database URLs",
    "service role keys",
    "anon keys",
    "wrangler deploy",
    "GitHub Actions scanner mode",
    "SARIF",
    "PR annotations"
  ],
  "allowed_now": [
    "read local manifest files",
    "read local SQL rehearsal files",
    "produce deterministic disabled status report",
    "validate safety boundary"
  ]
}
